{
  "scene_id": "jasper-ridge-unmixing-roi",
  "n_pixels": 10000,
  "n_labelled_pixels": 0,
  "wavelengths_nm": [
    380.0,
    390.7614,
    401.5229,
    412.2843,
    423.0457,
    433.8071,
    444.5685,
    455.33,
    466.0914,
    476.8528,
    487.6142,
    498.3756,
    509.1371,
    519.8985,
    530.6599,
    541.4213,
    552.1827,
    562.9442,
    573.7056,
    584.467,
    595.2285,
    605.9899,
    616.7513,
    627.5127,
    638.2741,
    649.0355,
    659.7969,
    670.5583,
    681.3198,
    692.0812,
    702.8427,
    713.6041,
    724.3655,
    735.1269,
    745.8883,
    756.6497,
    767.4112,
    778.1726,
    788.934,
    799.6954,
    810.4568,
    821.2183,
    831.9797,
    842.7411,
    853.5026,
    864.264,
    875.0254,
    885.7868,
    896.5482,
    907.3096,
    918.071,
    928.8325,
    939.5939,
    950.3553,
    961.1168,
    971.8782,
    982.6396,
    993.401,
    1004.1624,
    1014.9238,
    1025.6853,
    1036.4467,
    1047.2081,
    1057.9695,
    1068.731,
    1079.4924,
    1090.2538,
    1101.0153,
    1111.7766,
    1122.5381,
    1133.2994,
    1144.0609,
    1154.8224,
    1165.5837,
    1176.3452,
    1187.1066,
    1197.868,
    1208.6294,
    1219.3909,
    1230.1523,
    1240.9137,
    1251.6752,
    1262.4365,
    1273.198,
    1283.9594,
    1294.7208,
    1305.4822,
    1316.2437,
    1327.0051,
    1337.7665,
    1348.528,
    1359.2893,
    1370.0508,
    1380.8121,
    1391.5736,
    1402.3351,
    1413.0964,
    1423.8579,
    1434.6193,
    1445.3807,
    1456.1421,
    1466.9036,
    1477.6649,
    1488.4264,
    1499.1879,
    1509.9492,
    1520.7107,
    1531.472,
    1542.2335,
    1552.9949,
    1563.7563,
    1574.5178,
    1585.2792,
    1596.0406,
    1606.802,
    1617.5635,
    1628.3248,
    1639.0863,
    1649.8477,
    1660.6091,
    1671.3706,
    1682.132,
    1692.8934,
    1703.6548,
    1714.4163,
    1725.1776,
    1735.9391,
    1746.7006,
    1757.4619,
    1768.2234,
    1778.9847,
    1789.7462,
    1800.5076,
    1811.269,
    1822.0305,
    1832.7919,
    1843.5533,
    1854.3147,
    1865.0762,
    1875.8375,
    1886.599,
    1897.3604,
    1908.1218,
    1918.8833,
    1929.6447,
    1940.4061,
    1951.1675,
    1961.929,
    1972.6903,
    1983.4518,
    1994.2133,
    2004.9746,
    2015.7361,
    2026.4974,
    2037.2589,
    2048.0203,
    2058.7817,
    2069.5432,
    2080.3047,
    2091.0659,
    2101.8274,
    2112.5889,
    2123.3503,
    2134.1116,
    2144.873,
    2155.6345,
    2166.396,
    2177.1575,
    2187.9187,
    2198.6802,
    2209.4417,
    2220.2031,
    2230.9644,
    2241.7258,
    2252.4873,
    2263.2488,
    2274.0103,
    2284.7715,
    2295.533,
    2306.2944,
    2317.0559,
    2327.8171,
    2338.5786,
    2349.3401,
    2360.1016,
    2370.863,
    2381.6243,
    2392.3857,
    2403.1472,
    2413.9087,
    2424.6702,
    2435.4314,
    2446.1929,
    2456.9543,
    2467.7158,
    2478.4771,
    2489.2385,
    2500.0
  ],
  "class_distribution": [],
  "imbalance_gini": 0.0,
  "class_mean_spectra": {
    "global": {
      "mean": [
        0.014531,
        0.010519,
        0.034657,
        0.065362,
        0.077621,
        0.085977,
        0.090424,
        0.093177,
        0.095717,
        0.100213,
        0.105173,
        0.110539,
        0.119009,
        0.128075,
        0.13511,
        0.140269,
        0.144281,
        0.144653,
        0.142501,
        0.139556,
        0.134629,
        0.13003,
        0.128535,
        0.127807,
        0.127084,
        0.124911,
        0.121964,
        0.11919,
        0.118784,
        0.12046,
        0.12097,
        0.123632,
        0.132966,
        0.155124,
        0.181977,
        0.210052,
        0.234428,
        0.255966,
        0.271415,
        0.28064,
        0.288553,
        0.295368,
        0.300086,
        0.30427,
        0.306855,
        0.311506,
        0.315384,
        0.318409,
        0.322169,
        0.325869,
        0.329212,
        0.332848,
        0.337248,
        0.342416,
        0.34422,
        0.345727,
        0.347771,
        0.345259,
        0.344674,
        0.344369,
        0.3445,
        0.345952,
        0.345572,
        0.349361,
        0.353109,
        0.357668,
        0.361572,
        0.365963,
        0.370246,
        0.374306,
        0.378387,
        0.382313,
        0.388772,
        0.387965,
        0.38835,
        0.386363,
        0.381497,
        0.375837,
        0.372503,
        0.365,
        0.355626,
        0.349858,
        0.351335,
        0.350773,
        0.352169,
        0.354814,
        0.357842,
        0.363703,
        0.369043,
        0.373172,
        0.376933,
        0.380166,
        0.381966,
        0.382823,
        0.385482,
        0.385904,
        0.38477,
        0.383091,
        0.388332,
        0.394799,
        0.390097,
        0.384266,
        0.379908,
        0.385397,
        0.216469,
        0.20585,
        0.200522,
        0.197458,
        0.1941,
        0.193726,
        0.197034,
        0.201412,
        0.208468,
        0.215619,
        0.222461,
        0.230824,
        0.237613,
        0.243256,
        0.249349,
        0.255473,
        0.261744,
        0.26696,
        0.271968,
        0.27744,
        0.282044,
        0.285453,
        0.288583,
        0.291397,
        0.291728,
        0.29082,
        0.289891,
        0.288158,
        0.284762,
        0.281515,
        0.277682,
        0.274142,
        0.270905,
        0.269626,
        0.269374,
        0.27048,
        0.277713,
        0.279127,
        0.281774,
        0.289229,
        0.301252,
        0.167802,
        0.168437,
        0.169429,
        0.166279,
        0.168305,
        0.171778,
        0.174975,
        0.180085,
        0.179032,
        0.179663,
        0.180519,
        0.181759,
        0.184796,
        0.184039,
        0.181648,
        0.181405,
        0.180678,
        0.179474,
        0.178381,
        0.178148,
        0.179399,
        0.18094,
        0.182742,
        0.185063,
        0.187047,
        0.188761,
        0.190128,
        0.189994,
        0.187986,
        0.185161,
        0.181523,
        0.177245,
        0.17144,
        0.165945,
        0.159631,
        0.156103,
        0.152497,
        0.148435,
        0.147957,
        0.146334,
        0.146163,
        0.145361,
        0.145065,
        0.145769,
        0.143647,
        0.142951,
        0.140728,
        0.1357,
        0.13449,
        0.129884,
        0.124778,
        0.117353,
        0.114175
      ],
      "std": [
        0.008038,
        0.009892,
        0.020026,
        0.028472,
        0.038391,
        0.042736,
        0.045459,
        0.047355,
        0.048337,
        0.049925,
        0.051398,
        0.052553,
        0.051867,
        0.050152,
        0.049219,
        0.049483,
        0.050311,
        0.05283,
        0.055973,
        0.057209,
        0.05779,
        0.059002,
        0.060658,
        0.062186,
        0.063175,
        0.064961,
        0.066956,
        0.069229,
        0.070768,
        0.070181,
        0.072736,
        0.075098,
        0.076299,
        0.079871,
        0.094826,
        0.119846,
        0.144865,
        0.165119,
        0.178261,
        0.186668,
        0.193164,
        0.195904,
        0.198745,
        0.200969,
        0.202228,
        0.206197,
        0.210172,
        0.214018,
        0.216985,
        0.219967,
        0.2225,
        0.225618,
        0.228738,
        0.233028,
        0.235013,
        0.235977,
        0.23733,
        0.238782,
        0.240555,
        0.239015,
        0.235743,
        0.235428,
        0.235009,
        0.237542,
        0.240396,
        0.243773,
        0.24683,
        0.250252,
        0.253505,
        0.256539,
        0.259536,
        0.262357,
        0.266919,
        0.266393,
        0.266715,
        0.265461,
        0.263932,
        0.26352,
        0.259092,
        0.252926,
        0.244549,
        0.23736,
        0.237927,
        0.23765,
        0.238483,
        0.240407,
        0.242602,
        0.246748,
        0.250656,
        0.253726,
        0.256586,
        0.25858,
        0.256367,
        0.25872,
        0.260488,
        0.260811,
        0.260232,
        0.259035,
        0.262833,
        0.267422,
        0.26453,
        0.261571,
        0.259788,
        0.267937,
        0.17347,
        0.164284,
        0.159007,
        0.157184,
        0.154975,
        0.154297,
        0.156246,
        0.157169,
        0.159982,
        0.163506,
        0.167029,
        0.171675,
        0.175382,
        0.178409,
        0.18181,
        0.185388,
        0.189115,
        0.192377,
        0.195448,
        0.198998,
        0.202084,
        0.204313,
        0.206511,
        0.208431,
        0.208868,
        0.208395,
        0.207696,
        0.206453,
        0.204319,
        0.20231,
        0.200169,
        0.19812,
        0.196343,
        0.195993,
        0.19652,
        0.198527,
        0.204271,
        0.20633,
        0.20868,
        0.215445,
        0.226108,
        0.153246,
        0.151967,
        0.151863,
        0.147646,
        0.148432,
        0.150644,
        0.152721,
        0.155087,
        0.15325,
        0.152699,
        0.152523,
        0.152694,
        0.15442,
        0.152709,
        0.149847,
        0.148799,
        0.14743,
        0.14564,
        0.144108,
        0.143412,
        0.14392,
        0.144685,
        0.145412,
        0.146673,
        0.147655,
        0.148406,
        0.148772,
        0.148107,
        0.146304,
        0.143902,
        0.141159,
        0.138171,
        0.134085,
        0.130383,
        0.126118,
        0.12408,
        0.121778,
        0.119013,
        0.118636,
        0.117024,
        0.117524,